Names,Price,Minimum,Company,Origin,Ratings,Product Features List
High Quality Lady Original Brand Designer Light Lasting Fragrance Perfumes Women perfume,$1.85 - $2.05,Min. order: 3 pieces,"Zhejiang Meimi Technology Co., Ltd.",2 yrsCN Supplier,4.5/5.0 (31 reviews),Ready to Ship
Newest fresh and floral body mist long lasting body mist for Europe and America,$0.95 - $1.09,Min. order: 240 pieces,Dwangi Freshener Sdn Bhd,7 yrsCN Supplier,4.5/5.0 (12 reviews),Ready to Ship
Fast Delivery Sau-vage Fresh Scent 30mL Spray,$4.30 - $4.80,Min. order: 50 pieces,Japan Healthcare Institute Inc.,1 yrMY Supplier,4.8/5.0 (59 reviews),Glass BodyCosmeticPerfume
Clean fragrance natural perfume repair moisturize essence oil vegan yoni products,$90.00 - $100.00,Min. order: 1.0 box,"Guangzhou Laiwu Biotechnology Co., Ltd.",2 yrsJP Supplier,3.0/5.0 (2 reviews),Ready to Ship
Victoria's Spray Perfume 50ml Women's Brand Perfume Branded Original fragrance Dubai Arabic long Lasting women perfumes,$1.80 - $2.30,Min. order: 3000.0 pieces,Quanzhou City Licheng District Damei Shoes Firm,1 yrCN Supplier,4.4/5.0 (76 reviews),Easy ReturnReady to Ship
Diore For Men women cologne perfume perfumes original perfume bottle with box deodorant & antiperspiran,$13.10 - $21.90,Shipping per piece: $11.61,"Guangzhou Shengyi Chemical Technology Co., Ltd.",1 yrCN Supplier,4.8/5.0 (2 reviews),Ready to Ship
Original Perfume Body Spray 1:1 Bloom Profumo Di Fiori Perfume 100ml Female Eau De Parfum Long lasting Smell Top quality,$1.73 - $2.04,Min. order: 2 pieces,"Aboland Perfume Design Co., Ltd.",1 yrCN Supplier,4.4/5.0 (102 reviews),Ready to Ship
ABL Design Irregular Perfume Bottle Customize Parfum Bottle Unique Luxury Bottle,$1.00 - $3.00,Shipping per piece: $1.22,"Guangzhou Xincheng Cosmetics Co., Ltd.",2 yrsCN Supplier,5.0/5.0 (2 reviews),Ready to Ship
Pure Pink Women's Body Spray Perfumes for Women Wholesale,$1.23,Min. order: 96 pieces,"Henan Cun Lan Cosmetics Co., Ltd.",1 yrCN Supplier,5.0/5.0 (4 reviews),Easy ReturnReady to Ship
Wholesale 100Ml Pink Perfume High Quality Long Lasting Original Brand Perfume For Women,$4.30 - $5.10,Min. order: 10000.0 pieces,"Shenzhen Tongfei Trade Co., Ltd.",1 yrCN Supplier,4.4/5.0 (8 reviews),Ready to Ship
High Quality 50ML Pheromone Perfume Women Men Sex Passion Orgasm Body Emotions Perfume,$0.95 - $1.20,Min. order: 72 pieces,"Qing Dao Yavis Crafts co.,ltd",7 yrsCN Supplier,4.3/5.0 (23 reviews),Ready to Ship
Wholesale OEM inportado original 10ML 30ML 50ML 100ML women's and mens Floral / Fruity / Spicy / Woody Scent perfumes,$0.99 - $1.80,Min. order: 48 pieces,"Ganzhou Mycolor Cosmetics Co., Ltd.",6 yrsCN Supplier,4.5/5.0 (30 reviews),Ready to Ship
card perfume sample 2ml test tube mini perfume Long lasting for men and women,$0.10 - $0.15,Shipping per piece: $3.03,"Foshan Xiangdaoer Technology Co., Ltd.",7 yrsCN Supplier,4.5/5.0 (28 reviews),Ready to Ship
Wholesale Private Label Top Luxury Perfume Long Lasting Fragrance Women's Perfume,$15.00 - $24.00,Min. order: 12 pieces,"Guangzhou Zuofun Cosmetics Co., Ltd.",2 yrsCN Supplier,4.9/5.0 (28 reviews),Ready to Ship
Long lasting sweet floral fragrance oil perfumes for ladies women's,$1.55 - $1.75,Delivery by: Feb 23,"Henan Zhiershun Trading Co., Ltd.",9 yrsCN Supplier,4.3/5.0 (4 reviews),Ready to Ship
50ml women's perfume in high quality glass bottle with long lasting fragrance,$2.69 - $4.12,Shipping per piece: $3.73,"Shenzhen Yiouhao Product Design Co., Ltd.",1 yrCN Supplier,5.0/5.0 (2 reviews),Ready to Ship
North Moon Natural Fragrance Couple Dating Refreshing Men Women Luxury Perfumes Originales Al Por Mayor perfume,$0.59 - $1.28,Min. order: 10 pieces,"AHOY TRADING, LLC",1 yrCN Supplier,5.0/5.0 (3 reviews),Ready to Ship
wholesale Women's Perfume for sale,$4.00 - $6.93,Delivery by: Feb 12,ARYAN GLOBAL & CO.,1 yrUS Supplier,4.9/5.0 (9 reviews),Ready to Ship
"Hot selling Original Brand Long-Lasting Fogg Scent Xtremo 75 mlFresh & Powerful Fragrance, Eau De Parfum for men",$5.35 - $5.55,Shipping per piece: $0.80,"Guangzhou Yingli Cosmetics Co., Ltd.",1 yrIN Supplier,4.7/5.0 (10 reviews),Ready to Ship
natural and long-lasting pocket perfume Portable Solid balm perfume Aroma Deodorant Fragrance Body Antiperspirant,$0.51 - $0.65,Min. order: 10 pieces,"Shenzhen Tongfei Trade Co., Ltd.",4 yrsCN Supplier,4.9/5.0 (20 reviews),Ready to Ship
SHI MANG 50Ml Men's And Women's Perfume 8 Colors Long Lasting Herben Light Fragrance Water Sweet Natural Fruit Student Perfume,$1.08 - $1.45,Delivery by: Feb 28,"Guangzhou Lilac Biotechnology Co., Ltd.",4 yrsCN Supplier,4.6/5.0 (5 reviews),Ready to Ship
Tailaimei men's ball roll-on antiperspirant body fragrance sticks quick drying nourishing skin Women's antiperspirant,$0.45 - $0.59,Min. order: 50.0 pieces,"Hebei Xiujiesi Trading Co., Ltd.",1 yrCN Supplier,4.9/5.0 (19 reviews),NewReady to Ship
High Quality Wholesale Popular European Perfume 30ml Long Lasting Light Fragrance Perfume for Women for Home Salon,$4.00 - $4.50,Min. order: 10000 pieces,"Yiwu Xiangnuo Cosmetics Co., Ltd.",4 yrsCN Supplier,4.7/5.0 (101 reviews),Ready to Ship
35ml Long Lasting Perfume Oriental Floral Fragrance 20 pieces in 1 box Parfum Body Spray Design Private Label Women's Perfume,$0.38 - $0.50,Min. order: 100 pieces,"Ningbo Glantu Electronic Industry And Trade Co., Ltd.",1 yrCN Supplier,5.0/5.0 (1 review),Ready to Ship
"Women Private Perfume Feminine Inner Beauty Perfume for Underwear Attractive Scents Fragrance, 5ml/0.169 fl.oz",$0.70 - $0.75,Min. order: 8 pieces,"Shenzhen Unique Home Life Technology Co., Ltd.",5 yrsCN Supplier,5.0/5.0 (4 reviews),Easy ReturnReady to Ship
Wholesale Body Spray Perfume For Women's Perfume Private Label Design Your Own Perfumes Original,$1.50 - $2.20,Min. order: 500 pieces,"Union Chance Co., Ltd.",1 yrCN Supplier,4.5/5.0 (28 reviews),NewReady to Ship
MayCreate 88ml Charming for Women Fresh Long-Lasting Fragrance Classic Parfum Spray,$0.55 - $0.85,Min. order: 5 pieces,Thammasak,16 yrsCN Supplier,3.4/5.0 (13 reviews),Ready to Ship
Thai Scented Water Fragrance Perfume Scents Premium Best Selling Product from Thailand,$1.00 - $4.00,Shipping per piece: $1.98,Samerica Trade,1 yrTH Supplier,4.9/5.0 (24 reviews),New
"La Belle Paris - Kit Body Splash - 4 types - Seduction, Coconut, Intense, Strawberry - 200ml",$1.80,Min. order: 20 pieces,"Xuzhou Willings Import& Export Trading Co., Ltd.",2 yrsBR Supplier,4.6/5.0 (10 reviews),Ready to Ship
The latest women's perfume factory customized logo OEM big brand perfume processing,$2.75 - $3.04,Delivery by: Feb 21,Shenzhen Erade Technology Limited,2 yrsCN Supplier,4.5/5.0 (9 reviews),Ready to Ship
5ml Mini Perfume Atomizer Refillable Perfume Bottles Travel Sized Aluminum Perfume Atomizer Spray Bottle,$0.39 - $0.45,Shipping per piece: $6.66,Enrich Enterprises (Xiamen) Limited,7 yrsCN Supplier,4.2/5.0 (21 reviews),New
New Travel Size Long Lasting Rose Lavender Mint Fragrance Mint 10ml Women's Perfume,$0.71,Min. order: 3 pieces,"Guangzhou Shengyi Chemical Technology Co., Ltd.",15 yrsCN Supplier,4.8/5.0 (7 reviews),Ready to Ship
Women's Perfume original Long Lasting Parfum Femme glass bottle samples available,$1.10 - $1.30,Delivery by: Feb 23,"Linyi Weiyesi Daily Chemical Co., Ltd.",1 yrCN Supplier,4.7/5.0 (8 reviews),Ready to Ship
33ml 35ml Long Lasting Perfume Original Fragrance 20 in 1Parfum Body Spray Newest Design Private Label Women's Perfume,$0.52 - $0.58,Min. order: 144 pieces,"Quanzhou Fanyao Trading Co., Ltd.",4 yrsCN Supplier,4.5/5.0 (27 reviews),New
2023 Newest Yve Sain Laur Y Men's Perfume Perfumes Original High Quality Long Lasting Parfum Spray Fragrance Men's Perfume,$18.00 - $23.00,Min. order: 10 pieces,"Yiwu Excellence Cosmetics Co., Ltd.",2 yrsCN Supplier,4.8/5.0 (2 reviews),Ready to Ship
Body Mist Vic Secret Fragrance Love Seduce Body Spray and Lotion Set,$2.38 - $2.60,Min. order: 100 pieces,"Guangzhou Zuofun Cosmetics Co., Ltd.",8 yrsCN Supplier,4.7/5.0 (46 reviews),New
Long lasting sweet floral fragrance oil perfumes for ladies women's,$1.55 - $1.75,Shipping per box: $30.00,"Shenzhen Tongfei Trade Co., Ltd.",9 yrsCN Supplier,4.7/5.0 (32 reviews),Ready to ShipNew
SHI MANG 50Ml Men's And Women's Perfume 8 Colors Long Lasting Herben Light Fragrance Water Sweet Natural Fruit Student Perfume,$1.08 - $1.45,Min. order: 1 box,"Guangzhou Xingrui Technology Co., Ltd.",4 yrsCN Supplier,4.2/5.0 (54 reviews),New
Newest Design Private Label Women's Perfume lasting fragrance pheromone perfume,$1.00 - $1.74,Delivery by: Feb 28,"Guangzhou Qiaoqiaoliren Biotechnology Co., Ltd.",6 yrsCN Supplier,4.2/5.0 (15 reviews),Easy Return
QQLR Private Label Wholesale Original Women's Perfume Men's Perfume Set,$2.35 - $3.53,Shipping per piece: $14.42,A. A. PERFUMES,4 yrsCN Supplier,4.5/5.0 (44 reviews),Ready to Ship
LA MEMORIA Premium quality best perfume for women,$6.00,Min. order: 3 pieces,"Shantou Monbon Cosmetics Co., Ltd.",2 yrsIN Supplier,5.0/5.0 (4 reviews),NewReady to Ship
High Quality Wholesalers Perfumes Originales Al Por Mayor 125ml Manufacturing Luxury Men's Para Mujeres cologne for man Perfume,$0.60 - $0.80,Delivery by: Feb 12,"Guangzhou Jiayier Biological Technology Co., Ltd.",2 yrsCN Supplier,4.2/5.0 (7 reviews),Ready to Ship
45ML Pheromone Pockets Perfume Men Women Long Lasting Fragrance Students Fresh Natural Perfumes Body Scent Parfum,$1.08 - $1.28,Min. order: 500 pieces,THE SIX SATURDAY CO. LTD.,7 yrsCN Supplier,4.4/5.0 (82 reviews),Ready to Ship
Factory Wholesale Orchid Perfumes Long Lasting Perfume Spray 10ML Thailand,$11.00 - $12.00,Min. order: 100 pieces,"He' Nan Hangkai Trading Co., Ltd.",5 yrsTH Supplier,4.6/5.0 (18 reviews),Ready to Ship
women's perfume long lasting perfume arabic perfume,$5.76 - $6.29,Min. order: 10000 units,AJMAL INTERNATIONAL TRADING CO. (L.L.C.),1 yrCN Supplier,5.0/5.0 (2 reviews),New
Honey Fragrance WISAL EAU DE original Unisex perfume 50ML Spicy Floral Musky Fresh FOR MEN AND WOMEN,$21.50,Min. order: 50.0 pieces,"Shenzhen Beautyswan Technology Co., Ltd.",1 yrAE Supplier,5.0/5.0 (4 reviews),New
mix Colors Plastic Design Ladies Spray Custom logo Concentrated Private Label Wholesale Mujer Luxury Women's Perfume,$2.50 - $3.00,Shipping per piece: $0.35,"Yiwu Mantha Brand Planning Co., Ltd.",3 yrsCN Supplier,4.7/5.0 (3 reviews),New
Secret Perfume 30 ml Sexy Girl Women Perfume Fragrance Long Lasting Lady Parfum High Quality,$0.78 - $1.20,Min. order: 20 pieces,Thammasak,7 yrsCN Supplier,4.6/5.0 (25 reviews),New
Thai Scented Water Fragrance Perfume Scents Premium Best Selling Product from Thailand,$1.00 - $4.00,Delivery by: Feb 27,"Zhongying (Guangzhou) Pharmaceutical Biotechnology Co., Ltd.",1 yrTH Supplier,4.4/5.0 (7 reviews),New
New Brand 30ml Female Perfume Deodorant Body Spray Strong Female Fragrance Perfume Long Lasting Eau De Parfum Women Perfume,$1.34 - $1.49,Min. order: 5000 pieces,"Beauty-Soaps Commodity Co., Ltd.",1 yrCN Supplier,4.1/5.0 (5 reviews),New
2014 Nice Cologne Nice perfume for women,$0.10 - $0.80,Shipping per piece: $1.25,"Hangzhou Forever Beauty Cosmetics Co., Ltd.",14 yrsCN Supplier,4.4/5.0 (66 reviews),NewReady to Ship
Popular perfume bottle glitter women and men long time leaving perfume wholesale private label,$1.30 - $2.00,Min. order: 10 pieces,"Zhejiang Meizhiyuan Cosmetics Co., Ltd.",6 yrsCN Supplier,4.7/5.0 (49 reviews),Ready to Ship
Hot Selling Fine Fragrance Mixed Travel Size Body Mist Spray Perfume Set For Women 100ML 88ML,$0.75 - $0.85,Delivery by: Feb 22,"Shashatu (zhuhai) Cosmetic Co., Ltd.",5 yrsCN Supplier,4.9/5.0 (13 reviews),Ready to Ship
Brand Fragrance Set For Lady Gift Perfume Lipstick Gift Box Good Smell Long Lasting Women Perfume Set,$9.50 - $10.50,Min. order: 400 pieces,"Shenzhen Shunjing E-Commerce Co., Ltd.",2 yrsCN Supplier,4.7/5.0 (69 reviews),Ready to Ship
75 ml secret victoria lotion and perfume victoria wholesale secret body spray Fragrance Mist perfume splash women set,$0.99 - $2.99,Shipping per piece: $12.00,"Shenzhen Fargrass Trading Co., Ltd.",2 yrsCN Supplier,4.7/5.0 (32 reviews),Ready to Ship
Original Perfume 1:1 Women'S Perfume Designer Perfume for SakurA CHeRRY BLOSSOM COLOGNE 3.4 100 ML,$11.00 - $14.00,Min. order: 2 pieces,Pucheng County Lefan Department Store,1 yrCN Supplier,4.5/5.0 (35 reviews),Ready to Ship
Indulge in the allure of luxury with women's exquisite floral and fruity fragrances from exclusive luxury perfume collections,$27.69 - $34.61,Delivery by: Feb 28,"Guangzhou Jingyuan Trading Co., Ltd.",1 yrCN Supplier,3.0/5.0 (2 reviews),Ready to Ship
Perfume Women 50ml Natural Fresh Flora And Fruity Original Long Lasting Vip Lady Perfume,$1.20 - $1.80,Min. order: 48 pieces,"Shanghai Hexuanshu Industrial Co., Ltd.",2 yrsCN Supplier,4.6/5.0 (8 reviews),Easy ReturnReady to ShipNew
Wholesale luxuries spray bottle cheap body mist fragrance perfume for woman,$1.20 - $1.60,Min. order: 10000 pieces,"Shanghai Seli Industry&Trade Co., Ltd.",6 yrsCN Supplier,4.6/5.0 (8 reviews),Ready to Ship
50ml Original Women's Perfume High Quality Arabic Perfume Eau de Toilette Good Girl Perfume Fragrance Body Spray,$1.29 - $1.69,Shipping per piece: $6.66,DE KOZMETIK SANAYI VE TICARET LIMITED SIRKETI,5 yrsCN Supplier,4.9/5.0 (4 reviews),New
Ital Women 90 Ml Perfume Gold Natural Women's Perfume Factory Sale Eau De Parfum High Quality Personal Care for Women Perfume,$2.60 - $3.12,Min. order: 3 pieces,"Guangzhou Hande Biotechnology Co., Ltd.",2 yrsTR Supplier,4.9/5.0 (32 reviews),Ready to Ship
Wholesale good quality 250ML Fragrance Long Lasting perfumes original brand perfume para mujeres,$1.28 - $2.28,Delivery by: Feb 23,"Guangzhou Zuofun Cosmetics Co., Ltd.",1 yrCN Supplier,4.9/5.0 (32 reviews),Ready to Ship
Private Label Good Quality Women perfume 100ml From Guangzhou Factory,$3.10 - $3.30,Min. order: 3 sets,"Guangzhou Shunmeile Trading Co., Ltd.",9 yrsCN Supplier,4.9/5.0 (120 reviews),Ready to Ship
Victoria's fleur Body Spray Perfume for Women's Long-lasting fragrance,$1.15 - $1.50,Shipping per piece: $5.50,"Nasiyi (guangzhou) Biology Science And Technology Co., Ltd.",1 yrCN Supplier,4.2/5.0 (54 reviews),Ready to Ship
Wholesale Perfumes Eau De Parfum Custom 75ml Long Lasting Women's Perfume,$1.64 - $2.58,Min. order: 10 pieces,"Guangzhou Yingying Biotechnology Co., Ltd.",3 yrsCN Supplier,4.5/5.0 (12 reviews),Ready to Ship
Wholesale HOT Sale 250ml High Quality Victoria Fragrance Deodorant Body Spray Perfume Body Mist,$1.43 - $1.60,Delivery by: Feb 12,DE KOZMETIK SANAYI VE TICARET LIMITED SIRKETI,6 yrsCN Supplier,4.5/5.0 (12 reviews),New
24 Hours Permanent Natural Women's Perfume Luxury Design High Quality Personal Care for Women Perfume,$1.00,Min. order: 20000 pieces,"Skylark Network Co., Ltd.",2 yrsTR Supplier,4.6/5.0 (8 reviews),New
2022 Big bottle women's perfume 250ml with spray-head mini fruity and floral long-lasting aromatic Body Mist perfume,$1.17 - $1.60,Shipping per piece: $14.28,LACTONE KOZMETIK SANAYI VE DIS TICARET ANONIM SIRKETI,4 yrsCN Supplier,4.9/5.0 (21 reviews),New
Hot Sale Wete by L'actone 50 ml Woman Perfume,$2.85 - $2.95,Min. order: 2 pieces,"Shanxi Binduo Technology Co., Ltd.",5 yrsTR Supplier,5.0/5.0 (4 reviews),New
Best Selling Long Lasting Refreshing Perfume Eau De Parfum Women Perfume,$1.52 - $1.88,Delivery by: Feb 16,"Shenzhen Twosuccess Electronic Co., Ltd. (Plus)",3 yrsCN Supplier,4.9/5.0 (21 reviews),Ready to Ship
Women's perfume lady temptation perfume high -end packaging long -term fragrance,$3.78 - $4.36,Shipping per piece: $1.94,"Shenzhen Huazhong Sun May Technology Co., Ltd.",9 yrsCN Supplier,5.0/5.0 (1 review),Ready to Ship
SM Christmas Gift Wholesale Victoria Fleur Body Spray 236ml Coconut Strawberry Fruity Women's Perfume,$1.50 - $2.50,Min. order: 10 pieces,"Yiwu Jiaoyun Import & Export Co., Ltd.",10 yrsCN Supplier,4.9/5.0 (21 reviews),NewReady to Ship
OLU909-179 35ML Tube Test New Arrival Wholesale Price Display Spray Good Smell Perfumes for Woman,$0.30 - $0.54,Delivery by: Mar 1,VIBER COLLECTION,6 yrsCN Supplier,4.8/5.0 (8 reviews),Easy ReturnReady to ShipWomen'sStainless SteelRomantic
Eau de Parfum WOODY OUD 80ml by Alhambra Natural perfume spray for women Dubai Perfumes,$14.00 - $16.50,Min. order: 50 pieces,"Zhejiang Meizhiyuan Cosmetics Co., Ltd.",4 yrsPK Supplier,4.9/5.0 (13 reviews),NewReady to Ship
Wholesale Lovali Paradise Park Luxury Long Lasting Original Brand Factory Sweety 100ml Women's Perfume,$1.20 - $1.40,Shipping per piece: $1.40,"Shanghai Maolei Information Technology Co., Ltd.",5 yrsCN Supplier,4.9/5.0 (21 reviews),Ready to Ship
Victoria Spray 250ml Custom Branded Fragrance Women's Perfume Gift Set,$1.31 - $1.60,Min. order: 50 pieces,"Guangzhou Xincheng Cosmetics Co., Ltd.",4 yrsCN Supplier,4.2/5.0 (5 reviews),Ready to Ship
Designer Tester Atomizer Essential Oil Perfume Famous Brands,$1.20,Delivery by: Feb 26,A. A. PERFUMES,1 yrCN Supplier,5.0/5.0 (4 reviews),Ready to Ship
TWINKLE WORLD Export Quality Body Mist Wholesale 250 ML perfume for women,$0.95,Min. order: 24 pieces,"Hebei Netfly Cultural Communication Co., Ltd.",2 yrsIN Supplier,5.0/5.0 (4 reviews),Ready to Ship
China Perfume Factory Original Female Women Generic Perfumes Wholesale,$4.50 - $5.50,Shipping per piece: $39.18,"Yiwu Meiji Import And Export Co., Ltd.",1 yrCN Supplier,5.0/5.0 (4 reviews),Ready to Ship
High Quality Women's Original Perfume Luxury Perfume Box Long Lasting 80ml Wooden Oriental Perfume,$2.50 - $5.80,Min. order: 1 piece,"Shenzhen Pengtuankunyun Technology Co., Ltd.",1 yrCN Supplier,4.2/5.0 (54 reviews),NewReady to Ship
long lasting women's perfume with customized logo perfumes original bottle with box,$6.00,Delivery by: Feb 13,"Shenzhen Pengtuankunyun Technology Co., Ltd.",3 yrsCN Supplier,4.2/5.0 (54 reviews),Ready to Ship
EDP deodorant stick of lattafa perfumes original mini gift box sets for women's perfume,$4.00 - $6.00,Min. order: 1 piece,VIBER COLLECTION,3 yrsCN Supplier,4.2/5.0 (54 reviews),Ready to Ship
Perfume BADEE AL OUD HONOR & GLORY by Lattafa 100 ML Eau de perfume Dubai Arabic perfumes UAE,$17.00 - $19.00,Min. order: 100 pieces,"Quanzhou Zhengda Daily Use Commodity Co., Ltd.",4 yrsPK Supplier,5.0/5.0 (4 reviews),NewReady to Ship
Factory Women's Menstrual High Quality OEM Brand Free Sample Disposable Cotton Sanitary Napkins Pads China,$0.02 - $0.03,Shipping per piece: $27.38,"Dongguan Happy Beauty Jewelry Co., Ltd.",8 yrsCN Supplier,5.0/5.0 (1 review),NewReady to Ship
Top Quality Life of Tree Perfume Oil Jewelry Necklace Locket in 361l Stainless steel Material for valentines's gift,$1.25 - $2.70,Min. order: 3 pieces,"Dongguan Happy Beauty Jewelry Co., Ltd.",7 yrsCN Supplier,4.7/5.0 (22 reviews),NewReady to Ship
Quality India Elephant CZ lava stone gold ball perfume diffuser necklace,$1.50 - $4.50,Delivery by: Feb 8,"Lucky Forever Hardware Products Dongguan Co., Ltd.",7 yrsCN Supplier,4.9/5.0 (79 reviews),Ready to Ship
new design best custom cat lovely skeleton pendant charms jewelry stainless steel magnet perfume pendants jewelries men women,$1.89 - $3.19,Min. order: 5000 pieces,"Shashatu (zhuhai) Cosmetic Co., Ltd.",12 yrsCN Supplier,5.0/5.0 (1 review),Easy ReturnReady to ShipNew
Dubai Arabic Perfume Wholesale Brand Women's Perfume with Floral and Fruit Tones Lasting Fragrance,$2.70 - $3.42,Shipping per piece: $5.45,"Zhejiang Meimi Technology Co., Ltd.",2 yrsCN Supplier,4.7/5.0 (18 reviews),NewReady to Ship
Hot Selling 2pcs Gift Set 250ml body mist and 200ml body cream with CHINA FACTORY,$2.10 - $2.51,Min. order: 1 piece,"Shenzhen Guiminghuan Technology Co., Ltd.",7 yrsCN Supplier,3.4/5.0 (13 reviews),New
Wholesale Women's Fragrances You make me strong EDP Long-lasting Seduction Perfume Luxury Oriental Passion Perfume,$19.98 - $25.98,Delivery by: Feb 23,"Zhejiang Meimi Technology Co., Ltd.",1 yrCN Supplier,4.5/5.0 (44 reviews),NewReady to Ship
Mothers Day 2pcs Gift Set 250ml body mist and 200ml body cream with LOW PRICE,$2.10 - $2.52,Min. order: 120 pieces,"Shenzhen Pengtuankunyun Technology Co., Ltd.",7 yrsCN Supplier,4.5/5.0 (44 reviews),Ready to Ship
new coming original oud perfume / perfumes original with customer brand women's perfume,$3.60,Shipping per piece: $77.33,"Shenzhen Fuhengjie Technology Co., Ltd.",3 yrsCN Supplier,4.5/5.0 (44 reviews),Ready to Ship
Private Label Long Lasting Original Ladies Perfumes de Mujer Paris Three-piece Women Perfume Gift Set,$3.00 - $7.00,Min. order: 3 pieces,HEMANI INTERNATIONAL (PVT) LIMITED,6 yrsCN Supplier,4.5/5.0 (44 reviews),Easy ReturnReady to Ship
HEMANI Rooh E Ramzan Perfume Collection Top Quality Private Label and Wholesale For Men and Women Unisex Perfume's Long Lasting,$14.00 - $17.30,Shipping per piece: $13.00,"Yiwu Jiaoyun Import & Export Co., Ltd.",1 yrPK Supplier,4.7/5.0 (18 reviews),Ready to Ship
Latest design and good quality scrub body spray long lasting women's fragrance,$1.08 - $1.72,Min. order: 1 piece,"Shenzhen Fuhengjie Technology Co., Ltd.",8 yrsCN Supplier,4.7/5.0 (18 reviews),Easy ReturnNew arrivals; sale on popular productsReady to Ship
Big Bottle Women's Perfume with Spray-head Mini Fruity and Floral Long-lasting Aromatic Body Mist Perfume,$3.00 - $7.00,Delivery by: Feb 28,"Yiwu Excellence Cosmetics Co., Ltd.",6 yrsCN Supplier,4.7/5.0 (18 reviews),Ready to Ship
Hot Selling 100ml Pracci Newest Fragrance SWEET CLOUD Customized EDP Long Time Lasting Female Perfume,$1.25 - $1.45,Shipping per piece: $12.00,"Yiwu Shuangxin Trading Co., Ltd.",8 yrsCN Supplier,4.7/5.0 (18 reviews),Ready to Ship
VV LOVE Colorful Glass Perfume Spray 35ml Unisex Pocket Perfume Private Label Perfume,$0.32 - $0.38,Min. order: 2 pieces,"Yiwu Shuangxin Trading Co., Ltd.",6 yrsCN Supplier,4.7/5.0 (18 reviews),Ready to Ship
VV LOVE Small And Portable Perfume 35ml Women's Perfume Fragrance Small Test Tube Ladies Perfume,$0.32 - $0.38,Delivery by: Feb 13,"Yiwu Shuangxin Trading Co., Ltd.",6 yrsCN Supplier,4.7/5.0 (18 reviews),Ready to Ship
VV LOVE Women's Test Tube Perfume Floral Scent Mixed Styles Perfume Sample Perfume Gift,$0.32 - $0.38,Shipping per piece: $30.00,DE KOZMETIK SANAYI VE TICARET LIMITED SIRKETI,6 yrsCN Supplier,4.7/5.0 (18 reviews),Easy ReturnReady to Ship
Nice Smell 24 Hours Permanent Natural Men's Perfume Natural Spray Vaporisaeur 100 ml Exclusive Personal Care for Men's Perfume,$1.00,Min. order: 2 pieces,DE KOZMETIK SANAYI VE TICARET LIMITED SIRKETI,2 yrsTR Supplier,4.7/5.0 (18 reviews),Ready to Ship
Ital Women 100 Ml Mystique Natural Women's Perfume Mystique Natural Spray Vaporisateur Nice Smell Personal Care Women Perfume,$2.60 - $3.12,Shipping per piece: $4.99,DE KOZMETIK SANAYI VE TICARET LIMITED SIRKETI,2 yrsTR Supplier,5.0/5.0 (1 review),Ready to Ship
Nice Smell Women 100 Ml Perfume Bommshel Natural Women's Perfume Bommshel Natural Spray Vaporisaeur 100 ml Women's Perfume,$2.60 - $3.12,Min. order: 3 pieces,DE KOZMETIK SANAYI VE TICARET LIMITED SIRKETI,2 yrsTR Supplier,5.0/5.0 (4 reviews),Online fashion retail new arrivals
Nice Smell Ital Women 90 Ml Perfume Silver Women Natural Perfume Factory Sale High Quality Personal Care for Women,$2.60 - $3.12,Delivery by: Mar 4,"Shenzhen Fuhengjie Technology Co., Ltd.",2 yrsTR Supplier,4.7/5.0 (69 reviews),Ready to Ship
Brand Perfume 100ML Eau De Parfum Long Lasting Body Spray Fragrance Original Women's Perfume,$5.99 - $7.99,Min. order: 120 pieces,"Shenzhen Weepro Technology Co., Ltd.",6 yrsCN Supplier,5.0/5.0 (1 review),Easy ReturnNewReady to Ship
Top Quality USA Stock 2-4Day Brand Women Perfume Chance Private Label 100ml Parfum Perfume Deodorant Body Spray Perfume Original,$25.00 - $45.00,Shipping per piece: $1.18,"Xiamen Jynbows Accessories Co., Ltd.",1 yrCN Supplier,4.8/5.0 (38 reviews),New
Luxury Silk Velvet Evening Knot Closure Wrist Bag Portable Cosmetic Organizer Pouch Ladies Hand Bag women's messenger bags,$2.76 - $3.74,Min. order: 100 pieces,"Shenzhen Fuhengjie Technology Co., Ltd.",13 yrsCN Supplier,5.0/5.0 (1 review),Ready to Ship
Top Quality Ford Rose Wood 50ml 100ml Unisex Perfume Men's And Women's Fragrance Perfume Spray,$5.99 - $7.99,Min. order: 1 unit,"Yiwu Zuoye Cosmetics Co., Ltd.",6 yrsCN Supplier,4.7/5.0 (14 reviews),Ready to Ship
3pcs Set Private Label Women's Perfume Wholesale Original Long-Lasting Luxcy Gift Box Set Perfume For Women,$2.80 - $3.20,Shipping per piece: $2.57,"Yiwu Jiaoyun Import & Export Co., Ltd.",1 yrCN Supplier,5.0/5.0 (1 review),New
Perfume 100ml Women's Fantasy Good quality perfume Long-lasting fragrance,$1.34 - $2.14,Min. order: 12 pieces,"Yiwu Jiaoyun Import & Export Co., Ltd.",8 yrsCN Supplier,4.7/5.0 (14 reviews),Easy ReturnReady to Ship
high quality wholesale 100ml women's perfume luxury perfume,$1.19 - $1.90,Min. order: 10000 pieces,"Yiwu Jiaoyun Import & Export Co., Ltd.",8 yrsCN Supplier,4.1/5.0 (19 reviews),NewReady to Ship
Perfume 100ml Floral and Fruity Fragrance High-Value Perfume Women's Perfume,$1.13 - $1.80,Shipping per box: $6.84,"Shashatu (zhuhai) Cosmetic Co., Ltd.",8 yrsCN Supplier,5.0/5.0 (4 reviews),Ready to Ship
RTS Wholesale High Quality Perfume set Original Exquisite Brand Gift Box Men's And Women's Perfume set,$3.20 - $3.80,Min. order: 12 boxes,"Shashatu (zhuhai) Cosmetic Co., Ltd.",2 yrsCN Supplier,5.0/5.0 (4 reviews),Ready to Ship
2023 New Perfume Ladies Gift Box Set Of 4 Flowers Bloom Women Perfume Travel Sets & Mini Fragrances originales,$3.50 - $4.20,Delivery by: Feb 7,"Shashatu (zhuhai) Cosmetic Co., Ltd.",2 yrsCN Supplier,4.7/5.0 (22 reviews),
NEW Sale Perfume Set Fragrance Luxury long lasting original Eau De Parfum Mini Perfume Gift Designer Set,$3.50 - $4.20,Min. order: 100 pieces,IVY BEAUTY CORPORATION SDN. BHD.,2 yrsCN Supplier,4.7/5.0 (22 reviews),
Women Fragrance AVII HER EDT_Alluring 50ml with the delicate Fragrance Long Lasting_Malaysia,$1.00 - $5.00,Min. order: 480 pieces,GLOCAL CORP.,13 yrsMY Supplier,4.8/5.0 (23 reviews),
Japan Pearl Barley Extract W Effects of Face Wash & Facial Cleansing 130g Medical Quasi-Drug Wholesale 2024 New Products,$1.52 - $1.67,Min. order: 1 unit,GLOCAL CORP.,17 yrsJP Supplier,4.6/5.0 (53 reviews),
