Names,Price,Minimum,Company,Origin,Ratings,Product Features List
Made in Japan Medicated Quasi-Drug W Effects of Face Wash & Facial Cleansing with Pearl Barley Extract 130g Wholesale Best 2023,$1.15 - $1.41,Min. order: 96 pieces,GLOCAL CORP.,17 yrsJP Supplier,4.6/5.0 (53 reviews),
Made in Japan W Effects of Face Wash and Facial Cleanser White Tsubaki Camellia Oil 190g Wholesale 2024 New Products,$1.52 - $1.86,Min. order: 1000.0 pieces,Pucheng County Lefan Department Store,17 yrsJP Supplier,4.6/5.0 (53 reviews),
Women's 100ml Long-lasting Fresh Floral and Fruity Fragrance Perfume perfume bottle with box,$2.65 - $3.32,Min. order: 20 pieces,"Yiwu Chuanfan Jewelry Co., Ltd.",1 yrCN Supplier,4.6/5.0 (53 reviews),
Stainless steel 18k gold net bag natural crystal heart stone adjustable knot net pendant necklace gemstone,$2.90 - $3.90,Min. order: 10 pieces,"Yiwu Shuangying E-Commerce Co., Ltd.",2 yrsCN Supplier,4.6/5.0 (26 reviews),
8mm Round Beads Natural Colorful Faceted Energy Stone Seven Star Chakra yoga Stretch Fashion Gorgeous Women Charm Bracelet,$1.13 - $1.28,Shipping per piece: $2.94,"Shenzhen Fundy Cosmetics Co., Ltd.",1 yrCN Supplier,4.6/5.0 (26 reviews),
Chinese Premium Quality Pink Perfume Sweetheart Perfume luxury For Women Perfume brands,$1.20 - $2.50,Min. order: 70 pieces,"Yiwu Excellence Cosmetics Co., Ltd.",6 yrsCN Supplier,4.6/5.0 (26 reviews),
Love Secret Victoria Perfume Body Spray Wholesale Secret Body Lotion Set,$2.30 - $2.50,Shipping per piece: $0.34,"SunGene CO,. LTD.",8 yrsCN Supplier,4.9/5.0 (24 reviews),
Factory Outlet: Original Brand Women's Perfume and Long-Lasting Spray Perfume for Men and Women,$2.89 - $3.86,Min. order: 288 pieces,"Yiwu Meiji Import And Export Co., Ltd.",1 yrTW Supplier,4.3/5.0 (8 reviews),
Hot Selling Women's Perfume Gift Set Long Lasting Fragrance Three Pieces Valentine's Day Gift,$2.20 - $5.60,Min. order: 6 pieces,"Guangzhou Xingrui Technology Co., Ltd.",1 yrCN Supplier,4.2/5.0 (54 reviews),
10ml Women's Perfume and Unisex Natural Perfume Gift Set High-End Long Lasting Light Fragrance Perfume Spray,$8.50 - $10.00,Min. order: 48 pieces,"Yiwu Meiji Import And Export Co., Ltd.",6 yrsCN Supplier,4.7/5.0 (12 reviews),
Hot Selling Fantasy Women's Perfume Long Lasting Fresh Woody Notes Eau de Toilette,$5.80 - $7.80,Shipping per piece: $2.14,"Shenzhen Fargrass Trading Co., Ltd.",1 yrCN Supplier,4.5/5.0 (12 reviews),
Original Perfume 1:1100Ml 3.3oz A Gloaming Night Perfume Long Lasting Eau De Parfum Designer Cologne Original Women'S Perfume,$11.00 - $14.00,Min. order: 480 pieces,"Shenzhen Fargrass Trading Co., Ltd.",1 yrCN Supplier,4.8/5.0 (5 reviews),
Original Perfume 1:1 Hot Selling Allure Sensuelle 100ML Brand High Quality Long Lasting Customize Women's Perfume,$11.00 - $14.00,Delivery by: Feb 28,"Shenzhen Fargrass Trading Co., Ltd.",1 yrCN Supplier,3.9/5.0 (49 reviews),
Original Perfume 1:1 TOP Hot Selling Perfume Allllure EDT Perfume 100ML Brand High Quality Long Lasting Women's Customize,$11.00 - $14.00,Min. order: 432 pieces,"Shenzhen Fargrass Trading Co., Ltd.",1 yrCN Supplier,4.4/5.0 (61 reviews),
Original Perfume 1:1 Women's perfume MiXED EMOTIONS Fragrance Spray Bal D'Afrique Gypsy Water Mojave Ghost Blanche EDP,$11.00 - $14.00,Min. order: 500 pieces,"SunGene CO,. LTD.",1 yrCN Supplier,3.9/5.0 (49 reviews),
Women's Perfume and Unisex Natural Perfume Gift Set 50ml Long Lasting Light Fragrance Own Brand Original Perfume Spray,$2.22 - $2.73,Min. order: 50 pieces,"SunGene CO,. LTD.",1 yrTW Supplier,4.4/5.0 (232 reviews),
Women's Perfume and Unisex Natural Perfume Gift Set 50ml Long Lasting Light Fragrance Own Brand Original Perfume Spray,$2.61 - $3.21,Shipping per piece: $18.33,"SunGene CO,. LTD.",1 yrTW Supplier,4.5/5.0 (44 reviews),
30ml Pheromone Women Perfume Dating Sex Hotel Long Lasting Mini Travel Mood Special Glamorous Sexy Thrilling,$0.67 - $0.82,Min. order: 3 pieces,"SunGene CO,. LTD.",1 yrTW Supplier,4.5/5.0 (44 reviews),
Women's Perfume and Unisex Natural Perfume Gift Set 60ml Long Lasting Light Fragrance Own Brand Original Perfume Spray,$2.66 - $3.28,Delivery by: Feb 27,"SunGene CO,. LTD.",1 yrTW Supplier,4.7/5.0 (32 reviews),
10g women's perfume Pheromone Roll On Perfume Dating Sex Hotel Long Lasting Mini Travel Mood Special Glamorous Sexy Thrilling,$1.51 - $1.85,Min. order: 5 pieces,"SunGene CO,. LTD.",1 yrTW Supplier,4.5/5.0 (44 reviews),
10g women's perfume Pheromone Roll On Perfume Dating Sex Hotel Long Lasting Mini Travel Mood Special Glamorous Sexy Thrilling,$1.06 - $1.31,Min. order: 5 pieces,"SunGene CO,. LTD.",1 yrTW Supplier,4.6/5.0 (3 reviews),
Unisex Long-lasting Light Fragrance Perfume for Students - Fresh and Natural Suitable for Gifting Personal Use and Travel,$1.53 - $1.76,Min. order: 6 pieces,"SunGene CO,. LTD.",1 yrTW Supplier,4.7/5.0 (32 reviews),
Women's Perfume and Unisex Natural Perfume Gift Set High-End 50ml Long Lasting Light Fragrance Perfume Spray,$1.19 - $1.54,Min. order: 350000 pieces,"Qingdao Kenuoda Industry & Trading Co., Ltd.",1 yrTW Supplier,5.0/5.0 (7 reviews),
50ml 100ml luxury creative women's perfume gift packaging paper box for men,$0.09 - $0.23,Shipping per piece: $0.55,"Yiwu Jiaoyun Import & Export Co., Ltd.",6 yrsCN Supplier,4.7/5.0 (12 reviews),
VL9059-33 ODM/OEM Cheap price women's 75ML body lotion+85ml body mist christmas gift sets,$1.35 - $2.21,Min. order: 100 pieces,"Yiwu Jiaoyun Import & Export Co., Ltd.",8 yrsCN Supplier,4.7/5.0 (12 reviews),
35ml support customize New Arrival Long Lasting woody Fragrance male test-tube mini perfume ODM/OEM,$0.33 - $0.54,Delivery by: Feb 21,"Quanzhou Houshi Pet Products Co., Ltd.",6 yrsCN Supplier,4.0/5.0 (21 reviews),
Private Label Long Lasting Original Ladies Perfumes de Mujer Paris Three-piece Women Perfume Gift Set,$3.10 - $3.80,Min. order: 100 pieces,"Nanchang Metis Trading Co., Ltd.",1 yrCN Supplier,5.0/5.0 (5 reviews),
long-lasting eau de toilette human peach Popular fragrance spray women's perfume,$10.00 - $24.00,Min. order: 100 pieces,"Nanchang Metis Trading Co., Ltd.",1 yrCN Supplier,5.0/5.0 (5 reviews),
Popular London women's long-lasting light fragrance floral and fruity fresh and natural eau de toilette perfume,$10.00 - $24.00,Shipping per piece: $77.33,"Shenzhen Inox Jewelry Co., Ltd.",1 yrCN Supplier,4.7/5.0 (12 reviews),
Women's Delicate Adjustable Healing Stainless Steel Diy Aroma Tree Of Life Perfume Aromatherapy Essential Oil Diffuser Bracelet,$1.70 - $2.38,Min. order: 3 pieces,"Nanchang Metis Trading Co., Ltd.",9 yrsCN Supplier,4.7/5.0 (12 reviews),
Gold Powder Quicksand Gilt Long-lasting Light Fragrance Floral and Fruity Fragrance Women's Perfume,$10.00 - $24.00,"Shipping per set: $1,057.00","Yiwu Xiangnuo Cosmetics Co., Ltd.",1 yrCN Supplier,4.7/5.0 (12 reviews),
Factory Direct Original Brand Women's Perfume Oriental Vanilla Fragrance Long Lasting Perfume Cologne,$1.29 - $1.50,Min. order: 24 sets,"Yiwu Xiangnuo Cosmetics Co., Ltd.",1 yrCN Supplier,4.7/5.0 (12 reviews),
Factory Supplier Accept Custom Logo Private Label Girls Perfume Female Perfume Spray 100ml Floral Eau De Parfum,$1.29 - $1.50,Delivery by: Feb 29,"Yiwu Xiangnuo Cosmetics Co., Ltd.",1 yrCN Supplier,4.6/5.0 (53 reviews),
Wholesale Long Lasting Refreshing Perfume Eau De Parfum Women Perfume Original Brand Floral Fruity Gourmand Fragrance,$1.25 - $1.47,Shipping per piece: $10.83,"Yiwu Xiangnuo Cosmetics Co., Ltd.",1 yrCN Supplier,4.6/5.0 (53 reviews),
Wholesale Women's Salon Perfume 100ml Hot Sale Floral Oriental Eau De Toilette Women's Perfume Brand Original Parfum,$1.25 - $1.47,Min. order: 6 pieces,"Yiwu Excellence Cosmetics Co., Ltd.",1 yrCN Supplier,4.4/5.0 (24 reviews),
OEM ODM Long Lasting Wholesale Arab Charm Price Brand Original Female Dubai Luca Bossi Perfume 100ml,$1.35 - $1.45,"Shipping per set: $1,057.00","Henan Three Capable Trading Co., Ltd.",8 yrsCN Supplier,5.0/5.0 (16 reviews),
"Arabian Perfume in Gift Box,Long-lasting Fragrance, Mysterious Oriental And Middle Eastern Fragrance Perfume",$5.50 - $6.70,Min. order: 24 sets,"Shantou Praisein Plastic Product Co., Ltd.",1 yrCN Supplier,4.7/5.0 (25 reviews),
"60ml/100ml Can be customized craft cartoon shape women's perfume spray bottle, empty plastic lotion container",$0.27 - $0.35,Delivery by: Feb 29,"Henan Three Capable Trading Co., Ltd.",2 yrsCN Supplier,4.8/5.0 (108 reviews),
"Arabian Perfume in Gift Box,Long-lasting Fragrance, Mysterious Oriental And Middle Eastern Fragrance Perfume",$5.50 - $6.70,Min. order: 5 pieces,Thammasak,1 yrCN Supplier,4.1/5.0 (49 reviews),
Thai Scented Water Fragrance Perfume Scents Premium Best Selling Product from Thailand,$1.00 - $4.00,Min. order: 100.0 pieces,"Yiwu City Young Girl Arts & Crafts Co., Ltd.",1 yrTH Supplier,4.1/5.0 (49 reviews),
Wholesale Stock 50ml Perfume Women with Gift Packing Long Lasting Fragrance Perfume Women's Perfume,$1.18 - $1.60,Min. order: 2 pieces,"Xi 'an Winkshow Beauty Products Co., Ltd.",4 yrsCN Supplier,3.9/5.0 (49 reviews),
wholesale 250ML victoria secret perfume body glitter fragrance spray long lasting s-ecret perfume fast shipping Women's perfume,$1.30 - $1.80,Min. order: 5000 pieces,"Xi 'an Winkshow Beauty Products Co., Ltd.",2 yrsCN Supplier,3.9/5.0 (49 reviews),
wholesale women's perfume arabes perfumes original perfumes originales al por mayor Victoria Fragrance,$1.30 - $1.80,Min. order: 100.0 pieces,"Nanyang Lisa Trade Co., Ltd.",2 yrsCN Supplier,,
30mm Stainless Steel Magnetic Perfume Essential Oil Diffuser Locket Pendant Bracelet for Fashion Jewelry Accessories,$1.50 - $1.70,Min. order: 48 pieces,"Nanyang Lisa Trade Co., Ltd.",6 yrsCN Supplier,,
30mm Stainless Steel Perfume Essential Oil Locket Pendant Bracelet for Fashion Jewelry Accessories,$1.50 - $1.70,Min. order: 2880 pieces,"Guangzhou Rongxin Packaging Printing Co., Ltd.",6 yrsCN Supplier,,
High quality perfume wholesale fresh floral fragrance lasting fragrance men's and women's perfume,$12.00 - $15.60,Min. order: 2880 pieces,"Henan Juxinding Trading Co., Ltd.",1 yrCN Supplier,,
women's perfume(old) ladies perfume long lasting fragrances blue man perfume Lasting Fresh One Piece Delivery,$2.81 - $3.11,Min. order: 2880 pieces,"Xi'an Meijian Technology Co., Ltd.",1 yrCN Supplier,,
Scrub Women's Perfume 50ml Light Fragrance Rose Peach Scent Fresh and Natural Niche girl's parfum,$0.65 - $1.20,Min. order: 1 unit,"Xi'an Meijian Technology Co., Ltd.",2 yrsCN Supplier,,
50ml quicksand gold-plated perfume women's lasting fragrance students' popular fantasy quicksand perfume cheap,$0.75 - $1.80,Min. order: 100 units,"Xi'an Meijian Technology Co., Ltd.",2 yrsCN Supplier,,
Wholesale women's Perfume Girl Natural Quicksand Cheap Perfume Fragrance 50ml Perfume,$0.75 - $1.50,Min. order: 1 unit,"Xi'an Meijian Technology Co., Ltd.",2 yrsCN Supplier,,
Famous Brand Original Fragrance Perfumes For Woman Charm Beauty Wholesale Women's Parfum 5th Avenue Perfume,$2.80 - $4.00,Min. order: 100 units,Sonimedi Co.,2 yrsCN Supplier,,
Upgraded SONIMEDI OVACO Fluid Cream provides smooth skin rhythm with natural moisturizing factor,$30.00,Min. order: 5 pieces,Sonimedi Co.,3 yrsKR Supplier,,
high satisfaction OVACO basic toner skin formulated with FIU method and skin-friendly elements to lessen the stress,$40.00,Shipping per piece: $0.00,Sonimedi Co.,3 yrsKR Supplier,,
high satisfaction SONIMED ICore Serum Rx serum developed to accommodate specific skin condition,$45.00,Min. order: 2 pieces,Sonimedi Co.,3 yrsKR Supplier,,
high satisfaction SONIMEDI Supply Cream maintains moisture all day long,$30.00,Delivery by: Feb 13,Hunan Supermacro Technology Co.Ltd.,3 yrsKR Supplier,,
Arab large Bottle perfume Dubai UAE Royal fragrance Lady long-lasting light perfume week perfume,$4.20 - $4.90,Shipping per piece: $1.27,Hunan Supermacro Technology Co.Ltd.,2 yrsCN Supplier,,
100ml Classic floral and fruity Arab perfume for women durable wholesale,$3.90 - $4.70,Min. order: 100 pieces,Hunan Supermacro Technology Co.Ltd.,2 yrsCN Supplier,,
gift box Arabic perfume Lasting Fragrance mysterious Middle East fragrance perfume,$4.50 - $5.10,Min. order: 100 pieces,"Techplus Gifts (shenzhen) Co., Ltd.",2 yrsCN Supplier,,
Wholesale fashion Rhinestone car pendant keychain Rhinestone perfume bottle shape keychain women's bag pendant accessories,$0.75 - $0.99,Min. order: 3 pieces,"Healing Essence co.,Ltd",7 yrsCN Supplier,,
Japanese small body mist spray bottle women's perfumes bulk sale,$13.00 - $18.00,Min. order: 5000 pieces,"Healing Essence co.,Ltd",1 yrJP Supplier,,
Japanese relieving stress body mist women's perfume bodymist wholesale,$13.00 - $18.00,Min. order: 5000 pieces,"Healing Essence co.,Ltd",1 yrJP Supplier,,
Japanese high-quality bulk women's perfumes spray for ladies,$13.00 - $18.00,Min. order: 5000 pieces,"Henan ZH Import&Export Co., Ltd.",1 yrJP Supplier,,
Wholesale OEM inportado original 10ML 30ML 50ML 100ML women's and mens Floral / Fruity / Spicy / Woody Scent perfumes,$4.70 - $5.40,Shipping per piece: $77.33,"Jl Glass Co., Ltd.",1 yrCN Supplier,,
Custom 30ml 50ml 100ml women's men's amber color glass perfume bottle with box,$0.18 - $0.28,Min. order: 3 pieces,NAJA THAI SHOP,10 yrsCN Supplier,,
Smoothing Gel Aloe Vera siam Buakhao for skin care korean skin care skin care set beauty organic cosmetics size 100 gm.,$1.25 - $1.50,Shipping per piece: $77.33,"Shashatu (zhuhai) Cosmetic Co., Ltd.",1 yrTH Supplier,,
Best-selling ladies' perfume floral fragrance Original Brand Quality Perfume for Men and Women,$1.80 - $2.40,Min. order: 3 pieces,"Zhejiang Meizhiyuan Biotechnology Co., Ltd.",2 yrsCN Supplier,,
Scenabella club de nuit intense womens perfume Victoria's Star 250ml bath body splash with 236ml bodyworks body lotion SG0064,$2.45 - $3.00,Shipping per piece: $77.33,ACO PERFUMES & COSMETICS LLP,3 yrsCN Supplier,,
Best Selling Perfume Bottles Wholesale 100ml Crimp Perfume Bottle With Box Luxury Perfume Bottle With Box,$1.20,Min. order: 3 pieces,ACO PERFUMES & COSMETICS LLP,1 yrIN Supplier,,
Best Selling Unisex Perfume Spray Long Time Leaving Women's Perfume Original Men Fragrance,$1.20,Min. order: 1000.0 pieces,ACO PERFUMES & COSMETICS LLP,1 yrIN Supplier,,
Perfume factory customized private label 100ml women's perfume body spray Perfume pour femme,$1.20,Min. order: 2400.0 pieces,"Zhejiang Meimi Technology Co., Ltd.",1 yrIN Supplier,,
mini 30ml woman perfume and 35ml body mist with box long lasting 50 different fragrance,$0.70 - $0.83,Min. order: 2160.0 pieces,"Guangzhou Wauke Trade Co., Ltd.",7 yrsCN Supplier,,
WT-P1709 Wholesale newest fashion gold long drop gemstone carved perfume bottle pendant tiny chic lady stone bottle pendant,$3.10 - $3.60,Min. order: 2160.0 pieces,BEYAZ KOZMETIK ITHALAT IHRACAT SANAYI VE TICARET LIMITED SIRKETI,10 yrsCN Supplier,,
AquaVera Body Splash Exalt 200 ml / AquaVera Body Spray Women's Perfume Exalt 200 ml,$1.40 - $1.60,Shipping per pair: $30.00,BEYAZ KOZMETIK ITHALAT IHRACAT SANAYI VE TICARET LIMITED SIRKETI,13 yrsTR Supplier,,
AquaVera Body Splash For Her 200 ml / AquaVera Body Spray Women's Perfume For Her 200 ml,$1.40 - $1.60,Min. order: 2 pairs,BEYAZ KOZMETIK ITHALAT IHRACAT SANAYI VE TICARET LIMITED SIRKETI,13 yrsTR Supplier,,
AquaVera Body Splash Ma Cherie 200 ml / AquaVera Body Spray Women's Perfume Ma Cherie 200 ml / AquaVera Body Mist,$1.40 - $1.60,Shipping per piece: $0.46,"Henan Chenben Trading Co., Ltd.",13 yrsTR Supplier,,
Women's perfume lasting fragrance flower fruit aroma aroma Vietnam perfume wholesale,$2.14 - $2.54,Min. order: 50 pieces,"Yiwu Showmee Trade Co., Ltd.",2 yrsCN Supplier,,
X480 pink stylish women quartz watches gift set perfume watch wallet,$1.15 - $1.65,Shipping per piece: $0.38,"Henan Chenben Trading Co., Ltd.",3 yrsCN Supplier,,
Women's fragrance lasting light fragrance Real me cocoa sin love bamboo sweet fragrance wholesale,$2.14 - $2.54,Min. order: 20 pieces,"Yiwu Gt Accessories Co.,ltd",2 yrsCN Supplier,,
Fashion Can Open Perfume Necklace Gold Plated Stainless Steel Chain Diy Healing Crystal Wishing Bottle Pendant Necklace,$2.97 - $3.32,Delivery by: Feb 28,"Shenzhen Fargrass Trading Co., Ltd.",7 yrsCN Supplier,,
Original Perfume 1:1 Women'S Perfume 100Ml Long-Lasting Fragrance Cologne Good Smell Body Spray Fashion Item Original,$11.00 - $14.00,Min. order: 20 pieces,"Shenzhen Fargrass Trading Co., Ltd.",1 yrCN Supplier,,
Original Perfume 1:1100ml Flora Gorgeous Gardenia Eau de Parfum Paris Cologne Women's Perfume Long Lasting Spray,$11.00 - $14.00,Min. order: 24 pieces,"Zhejiang Meizhiyuan Cosmetics Co., Ltd.",1 yrCN Supplier,,
Perfumed Body Mist (250ml) For Women,$2.20 - $2.50,Min. order: 3 pieces,"Shenzhen Fargrass Trading Co., Ltd.",5 yrsCN Supplier,,
Original Perfume 1:1 Women'S Perfume 90ml Love For Her Perfume Long Lasting Eau De Parfum Designer Cologne,$11.00 - $14.00,Shipping per piece: $18.33,Xiamen Huli District Lai Lai Du Shoes Clothing Firm,1 yrCN Supplier,,
Designer Perfume 100ml Apogee Rose Des Vents Contre Moi Mile Feux Edp Perfume Fragrance Top Quality Women Perfume,$13.99 - $20.00,Min. order: 3 pieces,"Zhejiang Meizhiyuan Cosmetics Co., Ltd.",1 yrCN Supplier,,
Hot Sale Wholesale Lovali parfum original 100ml private label perfume fragrance raspberry sweet women's perfume,$1.60 - $1.90,Delivery by: Feb 27,"Shenzhen Jeeva Technology Co., Ltd.",5 yrsCN Supplier,,
JEEVA 925 Sterling Silver Elegant Emerald Necklace Retro Braided Silver Neck Chain for Women Birthday Gift Fine Jewelry,$16.81 - $20.50,Min. order: 3 sets,"Zhejiang Meizhiyuan Biotechnology Co., Ltd.",10 yrsCN Supplier,,
Hot popular OEM/ODM Men's Perfume 100ml private label men perfume fragrance parfum original men cologne designer 15125,$1.30 - $1.50,Shipping per piece: $18.33,"Zhejiang Meizhiyuan Biotechnology Co., Ltd.",3 yrsCN Supplier,,
Wholesale Pocket Perfume 35ml Travel Size Perfume for Women,$0.33 - $0.38,Min. order: 3 pieces,"Fuzhou 100s Jewelry Co., Ltd.",3 yrsCN Supplier,,
Luxury Fashion AU750 Pure Real 18K Gold Pawnable Perfume Bottle Aquamarine Pendant Necklace Fine Jewelry Women Necklaces,$72.22 - $412.69,Delivery by: Feb 27,"Dongguan Zhongwen Watch & Jewelry Co., Ltd.",1 yrCN Supplier,,
Personalized Small Vial Locket Pendant Jewelry Essential Oil Diffuser Perfume Bottle Necklace,$5.85 - $6.85,Shipping per piece: $12.00,"Dongguan Zhongwen Watch & Jewelry Co., Ltd.",10 yrsCN Supplier,,
Custom Crystal Perfume Bottle Locket Stainless Steel Small Vial Necklace Jewelry for Women,$5.85 - $6.85,Min. order: 2 pieces,"Shenzhen Lojo Trading Co., Ltd.",10 yrsCN Supplier,,
Various luxury brand Women's Perfume long Lasting Fragrance Perfume sample sets,$1.50 - $9.50,Delivery by: Feb 13,Shenzhen MCZJ  Technology Com. Ltd,1 yrCN Supplier,,
Natural Gemstone Perfume Bottle Pendant Essential Oil Bottle Diffuser Freeform Shape Crystal Jewelry Vials Necklace,$2.58 - $3.13,Shipping per piece: $12.00,VIBER COLLECTION,1 yrCN Supplier,,
Eau de Parfum BAROQUE ROUGE 540 100ml by Alhambra Natural perfume spray for women Dubai Perfumes,$13.50 - $14.50,Min. order: 2 pieces,VIBER COLLECTION,4 yrsPK Supplier,,
Perfume Ameerat Al Arab 50ml By ASDAAF lattafa Dubai Arabic perfumes for women,$8.00 - $10.00,Delivery by: Feb 13,"Zhejiang Meizhiyuan Biotechnology Co., Ltd.",4 yrsPK Supplier,,
35ml Blossom & Honey Fruity Bloom Notes Mini Women's Designer Perfumes organic Fragrance 20 in 1 Gift Boxes 5796134,$0.33 - $0.38,Shipping per piece: $12.00,"Zhejiang Meizhiyuan Biotechnology Co., Ltd.",3 yrsCN Supplier,,
2023 Hair Perfume Mist Private Label 4pc Hair Perfume Berry Bow SG0144,$2.40 - $3.00,Min. order: 2 pieces,"Zhejiang Meizhiyuan Biotechnology Co., Ltd.",3 yrsCN Supplier,,
Woman customized creative lasting smell fruity women's original brand perfume mini body spray perfume 15065,$1.04 - $1.35,Delivery by: Feb 13,"Zhejiang Meizhiyuan Biotechnology Co., Ltd.",3 yrsCN Supplier,,
Hot Sale Perfume Gift Set 4PC Hair Perfume For Women Lemon Acid Fragrance,$2.40 - $3.00,Shipping per piece: $15.71,"Guangzhou Lianfen Biotechnology Co., Ltd.",3 yrsCN Supplier,,
Women's perfume Floral fragrance Fresh fragrance Natural lasting girl spray perfume,$1.17 - $1.35,Min. order: 2 pieces,"Guangzhou Fandisi Cosmetis Co., Ltd.",1 yrCN Supplier,,
Tiktok Perfume Set Fashion Long Lasting Fragrant 4 pcs Wholesale Gift Box Perfume Set Women's Perfume,$4.00 - $6.00,Delivery by: Feb 7,"Hansol Bio Co.,Ltd",2 yrsCN Supplier,,
B2B order korea beauty and korea perfume Celleanser Dress Perfume Warm Oriental 200ml made in Korea Dress perfume For Unisex,$1.00,Min. order: 3.0 pieces,"Guangzhou Fandisi Cosmetis Co., Ltd.",1 yrKR Supplier,,
Original Brand Parfum Women's Perfume Fragrance Oil High Quality Eau De Perfume,$10.00 - $15.00,Min. order: 3.0 pieces,"Henan ZH Import&Export Co., Ltd.",2 yrsCN Supplier,,
New Factory 35ml perfume Floral Tone Small Test Tube Women's perfume Long lasting fresh body spray Customized logo,$0.55 - $0.62,Min. order: 3.0 pieces,"Anhui Jiulianlong Health Technology Co., Ltd.",1 yrCN Supplier,,
Manufacturers wholesale body spray perfume cross-border ladies long-lasting fragrance,$1.09 - $1.19,Min. order: 3.0 pieces,"Guangzhou Tess Jewelry Co., Ltd.",3 yrsCN Supplier,,
Wholesale Bulk Conical Shape Natural Stone Perfume Bottle Pendant Stainless Steel Crystal Essential Oil Diffuser for Unisex Gift,$3.00 - $4.17,Min. order: 3.0 pieces,"Xuzhou Ou Nuo Packaging Products Co., Ltd.",7 yrsCN Supplier,,
Middle East Arabian Men's and Women's Perfume unisex perfume wholesale arabic perfumes,$0.55 - $2.15,Min. order: 3.0 pieces,NUCOS KOZMETIK KIMYA SANAYI VE TICARET LIMITED SIRKETI,3 yrsCN Supplier,,
High Quality Nucos Pocket Perfume 20 ML.,$0.70 - $0.90,Min. order: 3.0 pieces,NUCOS KOZMETIK KIMYA SANAYI VE TICARET LIMITED SIRKETI,9 yrsTR Supplier,,
Lisse Royal Matmazel / Elegant Perfume 100 ml / Parfum - Perfume Original High Quality Women's Perfume,$4.00 - $5.00,Min. order: 3.0 pieces,"Dongguan Qiandu Jewelry Co., Ltd.",9 yrsTR Supplier,,
Wholesale women jewelry stainless steel perfume essential oil bottle necklace jewelry,$1.99 - $2.86,Min. order: 3000 pieces,"Henan ZH Import&Export Co., Ltd.",7 yrsCN Supplier,,
Factory direct sales Middle East Arab perfume Natural Fragrance Men's and women's fragrance spray perfume,$3.78 - $4.25,Min. order: 960 pieces,IVY BEAUTY CORPORATION SDN. BHD.,1 yrCN Supplier,,
Premium Quality Glam Style Perfumed EDT mini travel size 10ml Malaysia OEM factory,$1.00 - $3.00,Min. order: 9600 pieces,IVY BEAUTY CORPORATION SDN. BHD.,13 yrsMY Supplier,,
Women Fragrance AVII HER EDT_Fantasy Dream 50ml with the delicate Fragrance Eau de Toilette_Malaysia,$1.00 - $5.00,Shipping per piece: $11.00,IVY BEAUTY CORPORATION SDN. BHD.,13 yrsMY Supplier,,
Women Fragrance AVII HER EDT_Alluring 50ml with the delicate Fragrance Eau de Toilette_Malaysia,$1.00 - $5.00,Min. order: 10 pieces,Yiwu Wuyan E Commerce Firm,13 yrsMY Supplier,,
90ml women perfume self boundless quicksand luxury perfume original women's perfume,$10.32 - $17.51,Delivery by: Feb 26,"Guangzhou Yimeitang Biotechnology Co., Ltd.",1 yrCN Supplier,,
Osmanthus Peony Pomegranate fragrance Adjustable diamond series perfume 50mBlack diamond Star Night Crystal Enchantress Perfume,$1.10 - $1.40,Min. order: 2 pieces,"Guangzhou Yimeitang Biotechnology Co., Ltd.",4 yrsCN Supplier,,
Wholesale Body Mist Fragrance 236ml Bodyworks Perfume Spray Victoria Women's Perfume,$0.70 - $2.25,Min. order: 2 pieces,"Henan Chenben Trading Co., Ltd.",4 yrsCN Supplier,,
Arab men's and women's perfumes Middle East foreign trade cross-border fragrance Dubai UAE Vietnam wholesale,$3.25 - $4.15,Shipping per piece: $1.57,"Henan Chenben Trading Co., Ltd.",2 yrsCN Supplier,,
Middle East Arab women's perfume trade cross-border perfume big boutel decoration store,$3.25 - $4.15,Min. order: 5 pieces,,2 yrsCN Supplier,,
,,Delivery by: Mar 1,,,,
,,Min. order: 2 pieces,,,,
,,Min. order: 72 pieces,,,,
,,Min. order: 72 pieces,,,,
,,Min. order: 72 pieces,,,,
,,Shipping per piece: $0.98,,,,
,,Min. order: 72 pieces,,,,
,,Min. order: 48 pieces,,,,
,,Shipping per piece: $52.51,,,,
,,Min. order: 2 pieces,,,,
,,Delivery by: Feb 21,,,,
,,Min. order: 10000 pieces,,,,
,,Min. order: 2 pieces,,,,
,,Min. order: 100 pieces,,,,
,,Shipping per piece: $9.67,,,,
,,Min. order: 3 pieces,,,,
,,Delivery by: Feb 29,,,,
,,Shipping per piece: $1.15,,,,
,,Min. order: 96 pieces,,,,
,,Delivery by: Mar 5,,,,
,,Shipping per piece: $1.15,,,,
,,Min. order: 96 pieces,,,,
,,Delivery by: Mar 5,,,,
,,Shipping per bag: $2.30,,,,
,,Min. order: 5 bags,,,,
,,Delivery by: Feb 22,,,,
,,Shipping per bag: $2.30,,,,
,,Min. order: 5 bags,,,,
,,Delivery by: Feb 22,,,,
,,Min. order: 8 pieces,,,,
,,Shipping per carton: $2.92,,,,
,,Min. order: 12 cartons,,,,
,,Delivery by: Feb 28,,,,
,,Shipping per piece: $12.00,,,,
,,Min. order: 5 pieces,,,,
,,Delivery by: Feb 28,,,,
,,Shipping per piece: $10.40,,,,
,,Min. order: 5 pieces,,,,
,,Delivery by: Feb 28,,,,
,,Shipping per piece: $10.40,,,,
,,Min. order: 5 pieces,,,,
,,Delivery by: Feb 28,,,,
,,Shipping per piece: $10.40,,,,
,,Min. order: 5 pieces,,,,
,,Delivery by: Feb 28,,,,
,,Min. order: 100 pieces,,,,
,,Min. order: 100 pieces,,,,
,,Min. order: 100 pieces,,,,
,,Min. order: 100 pieces,,,,
,,Min. order: 10 pieces,,,,
,,Min. order: 10 pieces,,,,
,,Min. order: 10 pieces,,,,
,,Shipping per piece: $0.71,,,,
,,Min. order: 50 pieces,,,,
,,Delivery by: Feb 20,,,,
,,Min. order: 48.0 pieces,,,,
,,Min. order: 48.0 pieces,,,,
,,Min. order: 48.0 pieces,,,,
,,Shipping per piece: $16.67,,,,
,,Min. order: 12 pieces,,,,
,,Delivery by: Feb 29,,,,
,,Min. order: 1000 pieces,,,,
,,Min. order: 360.0 pieces,,,,
,,Shipping per piece: $74.33,,,,
,,Min. order: 12 pieces,,,,
,,Min. order: 240 pieces,,,,
,,Min. order: 7200 pieces,,,,
,,Min. order: 7200 pieces,,,,
,,Min. order: 7200 pieces,,,,
,,Min. order: 200 pieces,,,,
,,Shipping per piece: $1.98,,,,
,,Min. order: 10 pieces,,,,
,,Delivery by: Feb 27,,,,
,,Min. order: 2000 pieces,,,,
,,Min. order: 2000 pieces,,,,
,,Min. order: 2000 pieces,,,,
,,Shipping per piece: $17.92,,,,
,,Min. order: 12 pieces,,,,
,,Delivery by: Feb 29,,,,
,,Shipping per piece: $2.23,,,,
